id,language,date,newspaper_id,iiif_url,relevancy,text
"neue_freie_presse_nfp19000704_article_211","de","1900-07-04T00:00:00Z","neue_freie_presse","https://platform.newseye.eu/iiif/neue_freie_presse_nfp19000704_page_6/1127,3220,1040,1199/!400,200/0/default.jpg","1","Ich bewahre mir, was den praktischen Werth der Zeppelin'schen
Erfindung anlangt, eine leider nur allzu gerechtsertigte Skepsis.
Der Zeppelin'sche Luftballon basirt auf denselben Principien, die
der Eefindung der Hauptleute Renard und Krebs in ChalaisMendon zu Grunde lagen. Diese Vorgänger des Grafen Zeppelin
haben im Jahre 1884 ein Lustschiff mit Eigenbewegung construirt,
das nach einer Fahrt von 20 Minuten nach seinem Aufstiegort zurückkehrte. Unter sechs Versuchen sind damals
fünf geglückt. Dieser Krebs=Renard'sche Ballon, der die Fischform
hatte, war 50•42 Meter lang, hatte 8·4 Meter größten Durchmesser und 1864 Kubikmeter Inhalt. Das Schiff, das aus
Bambus gefertigt war, befand sich unterhalb des Ballons, und
am Vordertheil des Schiffes war die zweiflügelige Propellerschraube
angebracht. Eine Gramme'sche Dynamomaschine gab dem Luftschiff eine Eigengeschwindigkeit von 6·2 Metern in der Secunde.
Der Fortschritt des Grafen Zeppelin besteht in der gesteigerten Geschwindigkeit; aber diese Steigerung ist keine allzu
große. Sie beträgt höchstens 1 bis 1½ Meter. Im Uebrigen ist der
Krebs=Renard'sche Ballon auch nach Zeppelin nach meiner Ansicht der beste, der bisher construirt wurde. Man darf übrigens
nicht vergessen, daß jeder Ballon lenkbar ist, in ruhiger
Luft nämlich. Ein Anderes ist, wenn sich ein Wind erhebt.
Die größere Geschwindigkeit des Zeppelin'schen Ballons hängt mit
den Riesendimensionen zusammen, in denen er gebaut ist. Aber
eben diese Dimensionen bedeuten wieder einen theilweisen Rückschritt, da man mit einem solchen Ungethüm nicht manövriren
kann, und sich die Schwierigkeiten bei der Füllung, beim Abflug
und namentlich bei der Landung in ganz erheblichem Maße
steigern. Die Fischform des Ballous von Krebs und Renard war
entschieden vorzuziehen, da sie besser den Zweck erreichte, die Lust
mit geringem Widerstand zu durchschneiden."
"neue_freie_presse_nfp19000704_article_212","de","1900-07-04T00:00:00Z","neue_freie_presse","https://platform.newseye.eu/iiif/neue_freie_presse_nfp19000704_page_6/1130,4417,1037,272/!400,200/0/default.jpg","1","Es bestärkt mich in meinem Mißtrauen und in meiner
pessimistischen Auffassung, daß Graf Zeppelin in der Windrichtung gelandet ist, überhaupt an einem Orte, der nicht
für die Landung in Aussicht genommen war. Er hat lange, sehr
lange auf einen windstillen Tag gewartet und kam dann erst
recht nicht zu seiner Halle zurück, während dies seinen
Vorgängern Krebs und Renard vollständig geglückt ist."
"neue_freie_presse_nfp19361016_article_413","de","1936-10-16T00:00:00Z","neue_freie_presse","https://platform.newseye.eu/iiif/neue_freie_presse_nfp19361016_page_9/2210,3400,1043,135/!400,200/0/default.jpg","1","(2), Krebs (3), Geiter, Gallasz und Wobornik fielen. Wacker
besiegte Oldham 8:1 (2:1). Die Torschützen der Sieger waren
Walzhofer (3), Hahnreiter (2), Zischek, Belonoc und Mayerts."
"neue_freie_presse_nfp19390102_article_276","de","1939-01-02T00:00:00Z","neue_freie_presse","https://platform.newseye.eu/iiif/neue_freie_presse_nfp19390102_page_5/2247,4790,1039,406/!400,200/0/default.jpg","1","Hauptschriftleiter: Dr. Rudolf Fischer.
Stellvertreter und Chef vom Dienst: Fritz Eckrich. Verantwortlich für Innenpolitik: i. V. Kurt v. Hirtl; für Außenpolitik: Dr. Rudoli Fiicher;
für den Economist und die volkswirtschaftlichen Beilagen: Dr. Günther
Krebs; für Kulturpolitik und Unierhaltung: Louis Barcata;
für Musik: Hubert Ritter; für Chronit, Lokales und den unpolitischen Teil:
Wolfgang Thomas; für Sport: Ludwig Schüssel; für die Anzeigen: Hans Zehetgruber, sämtlich in Wien. Druck und Verlag:
Oesterreichische Journal Ach, Wien, 1. Fichtegasse 11. Die Schriftleitung betreffende Zuschriften, welcher Art auch immer, bitten wir an die „Schriftleitung“
als folche. nicht aber an einzelne Mitglieder der Schriftleitung zu richten.
Derzeit gilt Anzeigenproisliste Nr. 3. (Für „Kleine Anzeigen“ Preisliste Nr. 2)"
"neue_freie_presse_nfp19390107_article_247","de","1939-01-07T00:00:00Z","neue_freie_presse","https://platform.newseye.eu/iiif/neue_freie_presse_nfp19390107_page_5/2191,4786,1038,372/!400,200/0/default.jpg","1","Hauptschriftleiter: Dr. Rudolf Fischer.
Stellvertreter und Chef vom Dienst: Fritz Eckrich. Verantwortlich für Innenpolitik: i. V. Kurt v. Hirtl; für Außenpolitik: Dr. Rudoli Fischer;
für den Economist und die volkswirtschaftlichen Beilagen: Dr. Günther
Krebs; für Kulturpolitik und Unterhaltung: Louis Barcata:
ür Musik: Hubert Ritter: für Chronik, Lokales und den unpolitischen Teil:
Wolfgang Thomas; für Sport: Ludwig Schüssel; für die Anzeigen: Hans Zehetgruber, sämtlich in Wien. Die Schriftleitung betreffende Zuschriften, welcher Art auch immer bitten wir an die „Schriftleitung“
als solche, nicht aber an einzelne Mitglieder der Schriftleitung zu richten.
Derzeit gilt Anzeigenpreisliste Nr. 3. (Für „Kleine Anzeigen“ Preisliste Nr. 2."
"neue_freie_presse_nfp19380814_article_176","de","1938-08-14T00:00:00Z","neue_freie_presse","https://platform.newseye.eu/iiif/neue_freie_presse_nfp19380814_page_5/2213,3418,1038,359/!400,200/0/default.jpg","1","Hauptschriftleiter: Dr. Rudolf Fischer.
Stellvertreter und Chef vom Dienst: Fritz Eckrich. Verantwortsich für
Innenpolitik: i. V. Kurt p. Hirtl (Urlaub): für Außenpolitik: i. V. Dr. Rudolf
Fischer; für den Economist und die volkswirtschaftlichen Beilagen
Dr. Günther Krebs; für Kunst, Chronik und den unpolitifchen Teil:
Louis Barcata; für Unterhaltung: Hubert Ritter; für Sport: Ludwig
Schüssel; für Film, Reise und Kraftfahrwesen: Wolfgang Thomus:
für die Anzeigen: Hans Zehetgruber, sämtlich in Wien. Druck und
Verlag: Oesterreichische Journal Ac, Wien, 1. Fichtegasse 11. Die Schriftleitung
betreffende Zuschriften, welcher Art auch immer, bitten wir an die „Schriftleitung“
als solche. nicht aber an einzelne Mitglieder der Schriftleitung zu richten."
"neue_freie_presse_nfp19001213_article_1253","de","1900-12-13T00:00:00Z","neue_freie_presse","https://platform.newseye.eu/iiif/neue_freie_presse_nfp19001213_page_14/113,652,539,361/!400,200/0/default.jpg","1","Ludwig, ihr f9jährig Cam. Gerzhofer.
jüngerer Söhn 123jährig Hr. Treßler.
Sommer 1 Agnes Hr. Lewinsky.
Frau Sommers Eltern Fr. Wilbrandt.
Adolf Krebs Hr. Sonnenthal.
Naporte, Opernsänger Hr. Kracher.
Hr. Witte.
Hr. Römpler.
Fr. Schmittlein.
Emma Blaha.
J. Spielmann.
Frl. Witt.
Hr. Sommer."
"neue_freie_presse_nfp19360910_article_283","de","1936-09-10T00:00:00Z","neue_freie_presse","https://platform.newseye.eu/iiif/neue_freie_presse_nfp19360910_page_6/1286,1736,1041,780/!400,200/0/default.jpg","1","Gestern vormittag nahm der Bundespräsident
die feierliche Eröffnung des unter seinem Ehrenschutz
stehenden VI. Kongresses der internationalen Gesellschaft für Urologie vor, der sich mit den drei
Hauptthemen: Krebs der Vorsteherdrüse, Eiterung des
Nierengewebes und Physiologie und Pathologie der Nierenausscheidung befaßt. Zu den Beratungen sind überaus viele
hervorragende Vertreter der Lehrkanzel der Urologie an den
Universitäten aus aller Welt eingetroffen. Von offizieller
österreichischer Seite waren zur Eröffnung des Kongresses
außer dem Bundespräsidenten Unterrichtsminister Doktor
Pernter, der Leiter des Volksgesundheitsamtes Sektionschef Dr. Müller, Vizebürgermeister Lahr, der Dekan der
Medizinischen Fakultät Universitätsprofessor Dr. Arzt erschienen. Auch Fürstin Fanny Starhemberg wohnte
dem Eröffnungsakt bei."
"neue_freie_presse_nfp19360910_article_294","de","1936-09-10T00:00:00Z","neue_freie_presse","https://platform.newseye.eu/iiif/neue_freie_presse_nfp19360910_page_6/2357,3291,1033,393/!400,200/0/default.jpg","1","Dozent Blatt (Wien) hat beim Prostatikermaterial der
letzten sechzehn Jahre in 328 Fällen eine bösartige Degeneration
von 16 Prozent festgestellt, so daß also beiläufig jeder sechste bis
siebente an Prostatahypertrophie Leidende krebskrank ist. Er
betont die Wichtigkeit dieser Erkenntnis im Hinblick auf die
immer mehr zunehmende elektrische Behandlung der Hypertrophie, die eine nicht radikale Methode darstellt, wobei also
ein eventuell vorhandener Krebs im Körper des Patienten
verbleibt."
"neue_freie_presse_nfp19360910_article_498","de","1936-09-10T00:00:00Z","neue_freie_presse","https://platform.newseye.eu/iiif/neue_freie_presse_nfp19360910_page_10/1276,747,1021,129/!400,200/0/default.jpg","1","Die von Staatsanwalt Dr. Krebs vertretene Anklage
berichtete, daß Gabriele Höntel am 3. März das Elternhaus verließ und erst zwölf Tage später in Begleitung des Hilfsarbeiters"
"neue_freie_presse_nfp19380720_article_405","de","1938-07-20T00:00:00Z","neue_freie_presse","https://platform.newseye.eu/iiif/neue_freie_presse_nfp19380720_page_5/2216,4865,1024,361/!400,200/0/default.jpg","1","Hauptschriftleiter: Dr. Rudolf Fischer (verreist)
Stellvertreter und Chef vom Dienst: Fritz Eckrich. Verantwortlich für
Innenpolitik: i. V. Kurt v. Hirtl; für Außenpolitik: t. V. Dr. Rudolf
Fischer; für den Economist und die volkswirtschaftlichen Beilagen
Dr. Günther Krebs; für Kunst, Chronik und den unpolitischen Teil:
Louis Barcata; für Unterhaltung: Hubert Ritter; für Sport: Ludwig
Schüssel; für Film, Reise und Kraftfahrwesen: Wolfgang Thomas;
für die Anzeigen: i. V. Raimund Anders, sämtlich in Wien. Druck und
Verkag: Oesterreichische Journal Ac, Wien, 1. Fichtegasse 11. Die Schriftleitung
detreffende Zuschriften, welcher Art auch immer, bitten wir an die „Schriftleitung“
ais wviche, nicht aber an einzelne Mitglieder der Schriftleitung zu richten"
"neue_freie_presse_nfp19380720_article_2205","de","1938-07-20T00:00:00Z","neue_freie_presse","https://platform.newseye.eu/iiif/neue_freie_presse_nfp19380720_page_24/2323,4917,1011,303/!400,200/0/default.jpg","1","auptschriftleiter: Dr. Rudolf Fischer (verreist)
tellvertreter und Chef vom Dienst: Fritz Eckrich. Verantwortlich füe
nnenpolitik: i. V. Kurt v. Hirtl; für Außenpolitik: i. V. Dr. Rudolf
ischer; für den Economist und die volkswirtschaftlichen Beilagen
r. Günther Krebs; für Kunst, Chronik und den unpolitischen Teilt
onis Barcata; für Unterhaltung: Hubert Ritter; für Sport: Ludwig
chüssel; für Film, Reise und Kraftfahrwesen: Wolfgang Thomas;
r die Anzeigen: i. V. Raimund Anders, sämtlich in Wien. Druck und
erlag: Oesterreichische Journal Ac, Wien, 1. Fichtegasse 11. Die Schriftleitung
treffende Zuschriften, welcher Art auch immer, bitten wir an die„"
"neue_freie_presse_nfp19000905_article_2229","de","1900-09-05T00:00:00Z","neue_freie_presse","https://platform.newseye.eu/iiif/neue_freie_presse_nfp19000905_page_22/2465,3668,924,191/!400,200/0/default.jpg","1","Thllophagplatten
Hühneraugenmittel „leiniger Erzeuger:
Alexander Freund, Oedenburg.
12 Stück 45 kr.) Zu bekommen in den meisten Apotheken, sicher: Krebs¬"
"neue_freie_presse_nfp19000606_article_2452","de","1900-06-06T00:00:00Z","neue_freie_presse","https://platform.newseye.eu/iiif/neue_freie_presse_nfp19000606_page_21/570,2651,533,191/!400,200/0/default.jpg","1","Junges anstandiges Fraulein (Aufg.) wünscht als Verkäuserin oder
Cassierin baldigst unterzukommen. Kaffeeund Gasthaus ausgeschlossen. Adresse:
R. Krebs, 16. Bez., Hoferpluo Nr. 4.
Thür 30. 54783—6"
"neue_freie_presse_nfp19130419_article_1339","de","1913-04-19T00:00:00Z","neue_freie_presse","https://platform.newseye.eu/iiif/neue_freie_presse_nfp19130419_page_16/2287,1707,1066,815/!400,200/0/default.jpg","1","[Konkursnachrichten.] Vom Wiener Handelsgerichte
wurde der Konkurs über die Schneider= und Modistenzugehörfirma
Reinhard Huber, Wien, 9. Bezirk, Währingerstraße 65, eröffnetKonkurskommissär ist Landesgerichtsrat Stern v. Rechfelden, einstweiliger. Masseverwalter Dr. Moritz Richard
Lichtenstein. Die Termine wurden für den 25. April, 27. Mai
und 2. Juni bestimmt. — In Konkurs sind ferner geraten: Josef
Wentz, Schneider in Graz, Josefigasse 51, Masseverwalter
Dr. Johann Terstenak; Johann Stadler, Mechaniker in Leoben,
Masseverwalter Dr. Wilhelm Dantine; Frau Charlotte Simon,
Modistin in Graz, Sackstraße 19, Masseverwalter Dr. Siegmund
Straßmann; Verlassenschaft des Luigi Zarazetti, gewesener
Handelsmann in Gradisca, Masseverwalter Dr. Vittorio Cesciutti.
[Konkurse und Zahlungseinstellungen.]
Das Oesterreichische Handelsmuseum teilt mit, daß über das Vermögen der Kaufleute Karl Ernst Walter Hesse, Mitgesellschafter der
offenen Handelsgesellschaft in Firma Ehrenberg & Co. in Liquidation, und Christian Otto Frederik Blume, Inhaber der Firmen
Krebs & Blume und Lenck & Co., Zigarren en gros, beide in
Hamburg, der Konkurs verhängt wurde. Außerdem können legitimierte heimische Interessenten unter Zahl 9803/E vertrauliche Mitteilungen über Zahlungseinstellungen in Rostow a. D.,
Stavrapol und Wladikawkas erhalten."
"neue_freie_presse_nfp19130419_article_1341","de","1913-04-19T00:00:00Z","neue_freie_presse","https://platform.newseye.eu/iiif/neue_freie_presse_nfp19130419_page_16/2299,2733,1055,423/!400,200/0/default.jpg","1","[Konkurse und Zahlungseinstellungen im
Ausland.] Die Exportabteilung der Wiener Handels= und Gewerbekammer meldet den Konkurs des Kaufmannes C. O. F.
Blume, alleinigen Inhabers der Firmen Krebs & Blume und
Lenck & Co., Zigarren, Hamburg, und des Kaufmannes C. E. W.
Hesse, Gesellschafters der Firma Ehrenberg & Co. in Liquidation und
der in Konkurs befindlichen Kommanditgesellschaft, in Firma Möbelfabrik Rosenhof, Max Berger, Kommanditgesellschaft. Anmeldungstermin 7. Juni, Liquidierungstagfahrt 2. Juli 1913. Ferner erhalten heimische Firmen unter Z. 74628 vertrauliche Auskünfte über
eine Firma in Rostow am Don und in Stavropol (Kaukasus),
welche ihre Zahlungen eingestellt haben."
"neue_freie_presse_nfp19000922_article_2138","de","1900-09-22T00:00:00Z","neue_freie_presse","https://platform.newseye.eu/iiif/neue_freie_presse_nfp19000922_page_18/167,2748,1051,44/!400,200/0/default.jpg","1","&4 Deiton Grand Hôtel Pittner, rother Krebs"
"neue_freie_presse_nfp19130725_article_582","de","1913-07-25T00:00:00Z","neue_freie_presse","https://platform.newseye.eu/iiif/neue_freie_presse_nfp19130725_page_9/75,2606,1063,1189/!400,200/0/default.jpg","1","Thema aus der Pathologie, Präsident Burns (London)
Staatshygiene, Professor Cushing (Harvarduniversitat) uver ein
chirurgisches Thema, Professor Bateson über Vererbung; die
Arbeiten des Kongresses werden in 33 Sektionen erledigt werden.
Aus der großen Zahl der Vorträge seien hervorgehoben:
Geheimrat His (Berlin) über Herzmuskeln, Professor Biedl
(Wien), Professor v. Koranyi (Budapest) und Geheimrat Kraus (Berlin) über Wechselbeziehungen zwischen Organen
mit innerer Sekretion und deren Störungen, Professor Fränkel
(Wien) über die Pathologie der Fettkörper, Abteilungsvorstand Dr. Freund (Wien) über Krebs, Geheimrat Gottlieb
(Heidelberg) über den Wert der Arzneimittel für Herzkrankheiten, Hosrat Hans Meyer (Wien) über Arzneien
gegen Schmerz und Schlaflosigkeit, Hofrat v. Noorden
(Frankfurt am Main) über Diabetes, Hofrat v. Eiselsberg
(Wien) über Behandlung der Gehirngeschwülste, Professor
Dollinger (Budapest) über Behandlung der Gelenkstuberkulose
Professor Wertheim (Wien) über Gebärmutterkrebs, Hofrat
Fuchs über Entzündung des Auginneren, Dozent Lauber
(Wien) über ein augenärztliches Thema, Professor Fisch!
Prag) über Drüsen ohne Ausführungsgang und Entwicklung,
Professor Finger (Wien) über die Syphilis als Staatsgefahr,
Assistent Dr. Marschek (Wien) über Geschwulst der Nase und
des Nasenrachenraumes, Professor Alexander (Wien) über
Erkrankungen des inneren Ohres, Dozent Barany (Wien)
über die Symptomatologie von Gehirn= und Ohrleiden,
Professor Possek (Graz) über Sehstörungen bei Schulkindern, Dozent Holzknecht und Dozent Kienböck (Wien) über
Röntgenuntersuchungen, Dr. de Ajkay (Budapest) über
Wasserversorgung im Felde, Professor Ehrlich (Frankfurt am"
"neue_freie_presse_nfp19380726_article_194","de","1938-07-26T00:00:00Z","neue_freie_presse","https://platform.newseye.eu/iiif/neue_freie_presse_nfp19380726_page_5/2236,4826,1023,347/!400,200/0/default.jpg","1","Hauptschriftleiter: Dr. Rudolf Fischer (verreist)
Stellvertreter und Chef vom Dienst: Fritz Eckrich. Verantwortlich ##
Innenpolitik: i. V. Kurt v. Hirtl; für Außenpolitik: i. V. Dr. Rudolf
Fischer; für den Economist und die volkswirtschaftlichen Beilagen
Dr. Günther Krebs; für Kunst, Chronik und den unpolitischen Teilt
Louis Barcata; für Unterhaltung: Hubert Ritter; für Sport: Ludwig
Schüssel; für Film, Reise und Kraftfahrwesen: Wolfgang Thomas;
für die Anzeigen: i. V. Raimund Anders, sämtlich in Wien. Druck und
Verlag: Oesterreichische Journal Ach, Wien, 1. Fichtegasse 11. Die Schriftleitung
betreffende Zuschriften, welcher Ert auch immer, bitten wir an die „Schriftleitung“
als solche, nicht aber an einzelne Mitglieder der Schriftleitung zu richten."
"neue_freie_presse_nfp19380726_article_2179","de","1938-07-26T00:00:00Z","neue_freie_presse","https://platform.newseye.eu/iiif/neue_freie_presse_nfp19380726_page_28/2220,4827,1018,328/!400,200/0/default.jpg","1","Hauptschriftleiter: Dr. Rudolf Fischer (verreist)
Stellvertreter und Chef vom Dienst: Fritz Eckrich. Verantwortlich s#e
Innenpolitik: i. V. Kurt v. Hirtl; für Außenpolitik: i. V. Dr. Rudolk
für den Economist und die volkswirtschaftlichen Beilagen
ZuGhünther Krebs; für Kunst, Chronik und den unpolitischen TeilLouis Barcata; für Unterhaltung: Hubert Ritter; für Sport: Ludwis
Schüssel; für Film, Reise und Kraftfahrwesen: Wolfgang Thomas;
ür die Anzeigen: i. V. Raimund Anders, sämtlich in Wien. Oruck und
Verlag: Oesterreichische Journal Ac, Wien, 1. Fichtegasse 11. Die Schriftleit
belreffende Zuschriften, welcher Art auch immer, bitten wir an die „Schriftleit
als solche. nicht aber an einzeine Mitglieder der Schriftkeitung zu"
"neue_freie_presse_nfp19380707_article_241","de","1938-07-07T00:00:00Z","neue_freie_presse","https://platform.newseye.eu/iiif/neue_freie_presse_nfp19380707_page_5/2259,4899,1009,338/!400,200/0/default.jpg","1","Hauptschriftleiter: Dr. Rudolf Fischer (verreist)
Stellvertreter und Chef vom Dienst: Fritz Eckrich. Verantwortlich für
Innenpolitik: i. V. Kurt v. Hirtl; für Außenpolitik: i. V. Dr. Rudolf
Fischer; für den Economist und die volkswirtschaftlichen Beilagen
Dr. Günther Krebs; für Kunst, Chronik und den unpolitischen Teil:
Louis Barcata; für Unterhaltung: Hubert Ritter; für Sport: Ludwig
Schüssel; für Film, Reise und Kraftfahrwesen: Wolfgang Thomas;
für die Anzeigen: i. V. Raimund Anders, sämtlich in Wien. Druck und
Verlag: Oesterreichische Journal Ac, Wien, 1. Fichtegasse 11. Die Schriftleitung
betreffende Zuschriften, welcher Art auch immer, bitten wir an die
als solche, nicht aber an einzelne Mitglieder der Schriftleitung zu richten."
"neue_freie_presse_nfp19380707_article_2457","de","1938-07-07T00:00:00Z","neue_freie_presse","https://platform.newseye.eu/iiif/neue_freie_presse_nfp19380707_page_26/2259,4868,1026,339/!400,200/0/default.jpg","1","Hauptschriftleiter: Dr. Rudolf Fischer (verreist)
Stellvertreter und Chef vom Dienst: Fritz Eckrich. Verantwortlich für
Innenpolitik: i. V. Kurt v. Hirtl; für Außenpolitik: i. V. Dr. Rudolf
Fischer; für den Economist und die volkswirtschaftlichen Beilagen
Dr. Günther Krebs; für Kunst, Chronik und den unpolitischen Teil:
Louis Barcata; für Unterhaltung: Hubert Ritter; für Sport: Ludwis
SHhüssel; für Film, Reise und Kraftfahrwesen: Wolfgang Thomas;
für die Anzeigen: i. V. Naimund Anders, sämtlich in Wien. Druck und
Verlag: Oesterreichische Journal Ach, Wien, 1. Fichtegasse 11. Die Schriftleitung
betreffende Zuschriften, welcher Art auch immer, bitten wir an die „Schriftleitung“
als solche, nicht aber an einzelne Mitglieder der Schriftleitung zu richten."
"neue_freie_presse_nfp19360426_article_92","de","1936-04-26T00:00:00Z","neue_freie_presse","https://platform.newseye.eu/iiif/neue_freie_presse_nfp19360426_page_3/2228,3508,1056,615/!400,200/0/default.jpg","1","Manche, Patienten fürchten sich vor einer Operation,
weil sie in der Operationsnotwendigkeit eine Bestätigung
dafür erblicken, daß es sich um ein Krebsleiden handle, und
bei diesem Leiden sei eine Heilung überhaupt ausgeschlossen.
Solchen Patienten gegenüber müssen sowohl Hausarzt wie
Chirurg in erster Linie Seelenarzt sein. Er muß trachten,
je nach dem Fall, entweder den Patienten von seiner Vermutung abzubringen oder ihn davon zu überzeugen, daß auch
Krebs im Anfangsstadium durch Operation dauernd geheilt
werden kann. Wenn der Patient nicht glauben will, daß zum
Beispiel bei Magenkrebs 20 bis 30 Prozent, bei Dickdarmkrebs 30 bis 50 Prozent Dauerheilungen erzielt wurden,
dann zeige ich ihm die betreffenden Stellen in den chirurgi¬"
"neue_freie_presse_nfp19360426_article_127","de","1936-04-26T00:00:00Z","neue_freie_presse","https://platform.newseye.eu/iiif/neue_freie_presse_nfp19360426_page_4/207,2175,1039,1608/!400,200/0/default.jpg","1","Der Magenkrebs, der außerordentlich häufig ist
der letzten Zeit offenbar zugenommen hat, kann heute bereits
mit Aussicht auf Erfolg operiert werden, und zwar nicht bloß
bei jüngeren Leuten, sondern auch bei alten Menschen bis
den achtziger Jahren hinauf, was in erster Linie dadurch
möglich geworden ist, daß bei der Operation die Allgemeinnarkose durch die Lokalanästhesie oder Rückenmarksbetäubung ersetzt werden kann. Während vor fünfzig Jahren,
zu Beginn der operativen Behandlung, die Sterblichkeit weit
über 50 Prozent bestand, ist sie heute in den Anfangsstadien,
solange der Krebs noch auf den Magen beschränkt geblieben
ist, bis auf 10 Prozent herabgesunken. Wenn aber bei längerer
Dauer der Erkrankung der Krebs auf die Nachbarorgane,
vor allem die Leber, die Bauchspeicheldrüse oder den Dickdarm, übergegriffen hat, steigt die Sterbeziffer bei Operationen. Trotzdem ist in diesen vorgeschrittenen Fällen ein
Operationsversuch berechtigt, weil leider mit der Röntgenund Radiumbehandlung beim Magenkrebs bisher noch keine
sicheren Erfolge erzielt werden konnten, anderseits aber auch
bei diesen vorgeschrittenen Fällen, die von vielen Chirurgen
für unheilbar gehalten werden, noch Dauerheilungen möglich
sind. Ich habe unter mehr als fünfhundert radikalen Operationen wegen Magenkrebs bei der ersten Gruppe, wo der
Krebs noch auf den Magen beschränkt war, 30 Prozent Dauerheilungen, bei der zweiten Gruppe immerhin noch 20 Prozent
Dauerheilungen mit einer Beobachtungszeit von fünf bis
zwanzig Jahren feststellen können. Der Dickdarmkrebs gehört
nach unseren Erfahrungen zu den mehr günstigen Krebsformen, da vor allem die Dauerresultate befriedigend sind.
Die Sterblichkeit ist bereits auf 12 bis 28 Prozent herabgedrückt worden. Der in der Literatur angegebene Prozentsatz
der Dauerheilungen schwankt zwischen 25 und 60 Proz.nt.
Der Mastdarmkrebs hat eine Sterblichkeit von 8 bis
25 Prozent."
"neue_freie_presse_nfp19360919_article_405","de","1936-09-19T00:00:00Z","neue_freie_presse","https://platform.newseye.eu/iiif/neue_freie_presse_nfp19360919_page_9/154,2596,1038,431/!400,200/0/default.jpg","1","Sir John Orr setzte sich dafür ein, den größten Teil des
Weidelandes in Ackerland zu verwandeln. „Unsere Ernährung
ist nicht deshalb gut und richtig“, rief er aus, „weil wir sie seit
unserer Kindheit gewöhnt sind. Essen wir hauptsächlich Früchte
und nur wenig Fleisch, würden beinahe alle Massenkrankheiten
verschwinden, beginnend bei dem Krebs, aufhörend bei den
schlechten Zähnen und dem Rheumatismus. Hier hat die Landesregierung die Pflicht, hier rücksichtslos einzugreifen und nicht
länger zuzusehen, wie unser kostbarer Boden vergeudet wird. Uns
fehlt dringendst eine nationale Ernährungspolitik!“"
"neue_freie_presse_nfp19000802_article_1506","de","1900-08-02T00:00:00Z","neue_freie_presse","https://platform.newseye.eu/iiif/neue_freie_presse_nfp19000802_page_15/2170,2196,1090,582/!400,200/0/default.jpg","1","Prospecte gratis. Telegramm - Adresse: „Erzjohann, Semmering
St Dälton Grand Hôtel Pittner, rother Krebs,
SI. I Uitel. 80 Schritte vom Bahnhofe, inmitten der Stadt,
101 Zimmer mit Salon, in jedem Stock Telephon, neu hochfeln
möblirt, neueste Heizungsanlagen, Wasserleit. und FeuerHydranten in jedem Stockwerke, Bäder im Hause. Grösstes und
feinstes Restaurant der Stadt. Zimmer von 50 kr. aufwärts. 12548
Triest, Hotel Volpich „zum schwarzen Adler“. Vollst.
TTIeSte neu möbl. Im. Centrum der Stadt. Restaurant und
Bäder im Hause, elektr. Licht. Mässige Preise. Bes. F. VOLPICH.
Venedig, Hôtel d'ltalle Baner. 10845
CheuI JUL. GRUNWALDsen., Besitzer.
Vöslan, Hotel Hallmayer, I. Ranges. Familien-Hotel
V Uslaie in nächster Nähe der Bäder. Während der Frühiahrs
u. Herbisaison ermässigte Preise. A. L. HERBSTER, Besitzerin."
"neue_freie_presse_nfp19380728_article_208","de","1938-07-28T00:00:00Z","neue_freie_presse","https://platform.newseye.eu/iiif/neue_freie_presse_nfp19380728_page_5/2246,4847,1026,364/!400,200/0/default.jpg","1","Ganscher von Dianstr Frlg dericgh, Peran
Mmengalilt 1. 2. Kuret v. Hierit sir Ahenent. 1. 9. Dr. Audon
Fischer; für den Cconomist und die volkswirtschaftlichen Beilagen
Dr. Günther Krebs; für Kunst, Chronik und den unpolitischen Teil„ Hareata: für Unterhaltung: Hubert Ritter; für Sport: Ludwig
Schuffel fue Film, Keis und Krastfahrwesen; Polfgang Thomast
für die Anieigen: I. B. Raimund Anders, sämtlich in Wien. Druck und
Verlag: Oesterreichische Journal AG, Wien, 1. Fichtegasse 11. Die Schriftleitung
betreffende Zuschriften, welcher Art auch immer, bitten wir an die „Schriftleitung“
als solche, nicht aber an einzelne Mitglieder der Schriftleitung zu richten.
Arongs nchr ai an tgn. dr Schchten."
