id,language,date,newspaper_id,iiif_url,relevancy,text
"neue_freie_presse_nfp19000809_article_1448","de","1900-08-09T00:00:00Z","neue_freie_presse","https://platform.newseye.eu/iiif/neue_freie_presse_nfp19000809_page_15/30,1500,1054,410/!400,200/0/default.jpg","1","Semmering, Grand Hôtél ErzberzogIchann.
Modernes Haus für die vornehme Welt.
130 Zimmer in verschiedener Grösse mit jedem Comfort, reizende
Salons, eine grosse schöne Halle, feines Kafféehaus etc. etc. Im
Zimmerpreis Alles inbegriffen: Service, elektr. Licht u. Heizung
Prospecte gratis. Telegramm- Adresse: „Erzjohann, Semmering“
St Däiton Grand Hôtel Fitiuer, rother Krebs,
Ot. 4 Oiten. 80 Schritte vom Bahnhofe, inmitten der Stadt,
101 Zimmer mit Salon, in jedem Stock Telephon, neu hochfein
möblirt, neueste Heizungsanlagen, Wasserleit. und FeuerHydranten in jedem Stockwerke, Bäder im Hause. Grösstes und"
"neue_freie_presse_nfp18710128_article_1281","de","1871-01-28T00:00:00Z","neue_freie_presse","https://platform.newseye.eu/iiif/neue_freie_presse_nfp18710128_page_15/1139,1714,1007,354/!400,200/0/default.jpg","1","Die wohlthätige Wirkung der Sellerie auf den Harn und
Apparat war
aus der ori
Tutt
var scho
talischen
Rrientalischen 
nehm erregend und belebend auf den ganzen Organismus, stellt die erschlaffte
Thätigkeit der betreffeuden Organe wieder her und erhält bei längerem Gebrauche
die Functionen derselben bis in das späteste Alter. „ „
Eine Flasche nebst Gebrauchsanweisung kostet 3 fl., 6 Flaschen 15 fl. und
ist zu bekommen in der Apotheke „zum rothen Krebs“ am Hohen
Markt in Wien, ferner in Pest bei Herrn Apoth. v. Török, Prag bei
Herrn Apoth. Jos. Fürst, Graz bei Herrn Apoth. Victor Grablowitz,
Krakau bei Herrn Apoth. E. Stokmar, Hermannstadt bei Herrn
J. J. Schneider, Brünn bei Herrn Apoth. Eder. Bei Versendung
20 kr. für Emballege. 83"
"neue_freie_presse_nfp19001017_article_198","de","1900-10-17T00:00:00Z","neue_freie_presse","https://platform.newseye.eu/iiif/neue_freie_presse_nfp19001017_page_6/1289,1340,1063,1551/!400,200/0/default.jpg","1","[Das Luftschiff des Grafen Zeppelin.]
Der für morgen angekündigte neuerliche Versuch des Grafen
Zeppelin, den von ihm construirten Ballon durch die
Lüfte zu lenken, hat in den hiesigen sachmännischen Kreisen
lebhaftes Interesse und gespannte Erwartung hervorgerufen.
Mit der größten Achtung und Anerkennung wird die Ausdauer und zähe Energie des Grafen Zeppelin beurtheilt, der
nach echter Soldatenart sich nicht abschrecken läßt, und bis
ans Ende gehen will. Leider sei das Experiment, wie schon das
erstemal, wieder an die Launen des Wetters gebunden, und
gerade an die oft sehr schlechte Laune des Herbstwetters. Der
Umstand, daß über Mittel=Europa ein Minimum liegt, läßt
keine für den Versuch günstige Prognose stellen. Eine
der größten Schwierigkeiten des Aufstieges liegt nun, wie wir
erfahren, darin, daß, wenn einmal die siebzehn Abtheilungen
des Zeppelin'schen Ballons mit Gas gefüllt sind, in Folge der
Penetration und Diffusion des Gases der Ballon stündlich an
Auftrieb verlieren muß. Wie nun der Versuch zu Ende Juni
dieses Jahres erwiesen hat, muß der Ballon, wenn er einmal
gefüllt ist, spätestens am vierten Tage nach der Füllung in die
Höhe steigen, mag das Wetter nun gut oder schlecht sein, oder
man muß sich entschließen, den Ballon unverrichteter Dinge
wieder zu entleeren. Man hält es in den hiesigen fachmännischen
Kreisen kaum fün möglich, die im Jahre 1884 von den
Franzosen Renard und Krebs errungenen Resultate zu
erreichen, geschweige denn dieselben zu übertreffen; denn es sei
eine bereits durch den ersten Versuch bewiesene Thatsache, daß
der monströse Bau des Zeppelin'schen Ballons (128 Meter
lang, 13 Meter breit) bei der Landung voraussichtlich wieder
Schaden leiden werde, während Renard und Krebs ihren
Ballon fünfmal glücklich durch die Lüfte gesteuert und unbeschädigt gelandet haben. In der Zusammenfassung des Pro
grammes für den neuerlichen Versuch zeigt sich, wie man hier
anerkennt, unverkennbar der kundige Blick und das tiefe Verständniß bewährter Fachleute. Zweifellos sei dieses Programm
in der Theorie richtia, aber ob das Wetter, das dem Versuche
gleichsam als Basis dient und daher eine Grundbedingung für
das glückliche Gelingen bildet, dem Unternehmen günstig sein
wird, müsse heute bezweifelt werden. Unter den an dem Auf¬"
"neue_freie_presse_nfp18710121_article_1009","de","1871-01-21T00:00:00Z","neue_freie_presse","https://platform.newseye.eu/iiif/neue_freie_presse_nfp18710121_page_14/1254,4341,346,385/!400,200/0/default.jpg","1","Arad, Tones & Comp.
Baden, Landschafts=Apoth.
Bologna, Tassi, Apothek.
Brood (Slavon.), J.D. Elia.
Brünn, L.Lusad, Ap. „Krebs“
Brzezan. W. Fadenhecht.
Cortina, Cambrnzzi Adr.
Böbling, Floder, Apoth.
Gmunden, Reymann, Ap.
Graz, Jos. Purgleitner, Ap.
Gr.-Kanizsa, Rosenberg.
Gr.-Ullersdorf, Müller.
Güns, St. Csacsirovicz, Ap.
(Tirol), L. v. Aichinger.
Spatzier, Ap."
"neue_freie_presse_nfp19390112_article_372","de","1939-01-12T00:00:00Z","neue_freie_presse","https://platform.newseye.eu/iiif/neue_freie_presse_nfp19390112_page_7/58,393,1035,334/!400,200/0/default.jpg","1","Operntheater: „Carmen“; Burgtheater: „Cromwell“;
Deutsches Volkstheater: „Liebe ist zollfrei“; Volksoper: „Der
Opernball“; Volksbildungsstätte Innere Stadt: Dr. Fr. Morton:
„Zwei Brennpunkte italienischer Kultur; Margareten: „Die Verhütung von Geistesstörungen“; Alsergrund: „Krebs, eine Geißel der
Menschheit“: Mozart=Saal: Konzert Christa Richter=Georg Steiner;
mittlerer Konzerthaussaal: Kammermusikabend, Prix=Quartett;
Figarv=Kammersaal: 44. Kammerkonzert; Universität: „Das
Wesen der deutschen Frömmigkeit“."
"neue_freie_presse_nfp18710113_article_962","de","1871-01-13T00:00:00Z","neue_freie_presse","https://platform.newseye.eu/iiif/neue_freie_presse_nfp18710113_page_14/2305,4265,362,564/!400,200/0/default.jpg","1","Tones & Comp.
Baden, Landschafts=Apoth.
Bologna, Tassi, Apothek.
Brood (Slavon.), J.D. Elia.
Brünn, L. Lusad, Ap. „Krebs“
W. Fadenhecht.
Cortina, Cambrnzzi Adr.
Döbling, Floder, Apoth.
Gmunden, Reymann, Ap.
Graz. Jos. Purgleitner, Ap.
Rosenberg.
Gr.-Ullersdorf, Müller.
Güns, St. Csacsirovicz, Ap.
Hall (Tirol). L. v. Aichinger.
Jägerndorf, Spatzier, Ap.
Kaaden, Hellmesser, Ap.
Karistadt (Croat.), Meder,
Apotheker.
Korneuburg, Kwizda, Ap.
Jof, Jahn.
Kreibitz, Joseph Hille."
"innsbrucker_nachrichten_ibn19361105_article_1009","de","1936-11-05T00:00:00Z","innsbrucker_nachrichten","https://platform.newseye.eu/iiif/innsbrucker_nachrichten_ibn19361105_page_16/2409,4610,1091,717/!400,200/0/default.jpg","1","Der amerikanischen Gelehrte Professor Tyndall Frank hat
einen Hundertjahrplan für die Wissenschaft zusammengestellt,
worin er ihr nachstehende Aufgaben zu lösen aufgibt:
Das Leben des Menschen bis zum 100. Jahr zu verlängern.
Schnelle radikale Heilung von Krebs und Arthritis. Vollkommene Beseitigung aller Arten von Schmerz. Gefahrlose Durchquerung der Welt in der Zeit von 24 Stunden. Drahtlose
Kraftübertragung ohne Energieverlust. Konstruktion von
Radiosendern und =empfängern im Taschenuhrformat. Reise
auf dem Mond mit einer Interplanetarmaschine. Herstellung
künstlichen Sonnenlichtes. Ermöglichung der Deckung des
Nahrungsbedarfes durch auf synthetischem Wege hergestellte
Chemikalien. Erhaltung der Frauenschönheit bis ins höchste
Alter. Vervollkommnung des farbplastischen Tonfilms, soweit,
daß eine volle Illusion der Wirklichkeit erzielt wird."
"innsbrucker_nachrichten_ibn19000522_article_43","de","1900-05-22T00:00:00Z","innsbrucker_nachrichten","https://platform.newseye.eu/iiif/innsbrucker_nachrichten_ibn19000522_page_3/58,3404,937,993/!400,200/0/default.jpg","1","Am häufigsten sind die Acclimatisationen auf dem
Gebiete der Fischzucht. Die bekannte Fischbrutanstalt Hüningen setzt seit Jahren alljährlich junge
Kalbrut im Gebiete der oberen Donau und ihrer
Nebenflüsse aus, um den dort unbekannten Aal einzubürgern; zahlreiche amerikanische Lachs= und Foreilenarten sind in den letzten Juhren mit Erfolg
in Mittelenropa acclimatisiert worden und zwar als
letzte die Purpur= oder Rothkehlchenforelle (Salmo
purpurata), welche ein ausgezeichneter Zuchtsisch ist,
und umgekehrt sind mehrere europäische Nutzfische
in amerikanischen Gewässern angesiedelt worden.
Diesen Ideen des Fortschrittes hat sich selbst der
rückschrittlichste Reactionär unter den Thieren, der
Krebs, nicht entziehen können. Seit dem allgemeinen
Auftreten der Krebspest ist dieser gepanzerte Herr,
der die Knochen außen hat, zum Leidwesen unserer
Feinschmecker recht selten geworden. Vor wenigen
Monaten nun ist es bekannt geworden, dass die
Einbürgerung des südrussischen, für die Krebspest
nicht empfänglichen Krebses gelungen ist. Unsere
Gourmands können daher wieder beruhigt aufathmen."
"arbeiter_zeitung_aze19110307_article_36","de","1911-03-07T00:00:00Z","arbeiter_zeitung","https://platform.newseye.eu/iiif/arbeiter_zeitung_aze19110307_page_1/2297,3706,1045,1063/!400,200/0/default.jpg","1","Der Schmerz ist unser bester Freund. Er warnt uns
und macht uns auf Gefahren aufmerksam, er führt uns zum
Arzt, niemals die Krankheit selbst. Es gibt gewisse heimtückische
Krankheiten, die ganz ohne Schmerzen einhergehen, die
gerade deshalb, zumal im Anfang, unsere Aufmerksamkeit nicht erregen und meist erst in ihrer ganzen Schwere
erkannt werden, wenn eine Heilung nur sehr schwer mehr
möglich ist. Eine solche Krankheit ist zum Beispiel der Krebs;
er schleicht einher, ohne Schmerzen zu machen, wird deshalb
nicht beachtet, und erst wenn die Krebsknoten eine erhebliche
Größe erreicht haben, meist schon in das Nachbargewebe hineingewuchert sind oder geschwürig zerfallen, wird ihr gefährlicher
Charakter dem Kranken offenbar und führt ihn zum Arzt.
Krankheiten, die ohne Schmerzen einhergehen, sind die heimtückischen Feinde, die den menschlichen Körper bedrohen. Außer
dem Krebs, der so vielen Schaden stiftet, gibt es nur noch
wenige; meist handelt es sich um bösartige Geschwülste. Ihrer
können wir uns nicht erwehren, weil sie uns nicht rechtzeitig
durch unseren Freund, den Schmerz, angezeigt wurden. Die
meisten, namentlich die akuten Krankheiten, innere wie äußere,
verursachen Schmerzen und zeigen dadurch an, daß irgend eine
Schädigung den Organismus getroffen hat. Wir sind jetzt gewarnt und können nun nach unseren Kräften dazu beitragen
den Feind zu bekämpfen."
"innsbrucker_nachrichten_ibn19110728_article_58","de","1911-07-28T00:00:00Z","innsbrucker_nachrichten","https://platform.newseye.eu/iiif/innsbrucker_nachrichten_ibn19110728_page_2/295,676,920,2270/!400,200/0/default.jpg","1","Zweiter Reichshandwerkertag in
Klagenfurt. Für diese Tagung wurde folgende Zeiteinteilung festgesetzt: Samstag, 12.
August, 7 Uhr abends, Begrüßungsabend im
großen „Sandwirtsaal“. Die Herren Delegierten
werden gebeten, wenn irgend tunlich, zur Zeit
des Begrüßungsabends bereits in Klagenfurt
zu sein. Sonntag, 13. August, 10 Uhr vormittag, Beginn des Reichshandwerkertages,
Stadttheater. (Ohne Ehren= oder Delegiertenkarte ist die Teilnahme nicht möglich, weil alle
Sitze vorher bestimmt werden.) — 8 Uhr
abends im großen „Sandwirtsaal“, Festabend.
Gesangsvorträge des Klagenfurter Männergesangvereines, des Männergesangvereines „Eintracht“, des Männergesangvereines „Frohsinn“
und Musikvorträge der St. Veiter Stadtkapelle. Montag, 14. August, 10 Uhr vormittags, Fortsetzung der ReichshandwerkertagVerhandlungen. Stadttheater. Nach Schluß
des Reichshandwerkertages Zusammenkunft im
Ausstellungs=Restaurant der Landes=Handwerkerausstellung; daselbst am Abend Abschiedstrunk.
Dienstag, 15. August, Besuch der LandesHandwerkerausstellung. Ausflüge in die Umgebung von Klagenfurt und Villach. — Die
Tagesordnung für die Beratungen lautet: 1.
Die Handwerksverhältnisse in Deutschland. Redner: Herr Kommerzialrat Max Nagler=München, Präsident des bayerischen Handwerkerbundes. 2. Unsere Politik und das deutsche
Handwerk. Redner: Herr Reichsratsabgeordneter Wolfgang Dobernig=Klagenfurt, Vorsitzender
der freien gewerblichen Vereinigung des Abgeordnetenhauses. 3. Gewerbeschulfragen. Berichterstatter: Kaiserl. Rat Bäckermeister WöhrleLinz, Landtagsabgeordneter, Gewerberat. 4. Unser Verhältnis zur Arbeiterschaft. Berichterstatter: Stadtzimmermeister Andreas BaudouinWien, Tirektor der Zimmerer=Fachschule und
Präsident des Zimmermeisterverbandes Österreichs. 5. Die Firmaprotokollierung der Gastund Schankgewerbetreibenden. Berichterstatter:
Handwerkerrat Fabian=Brünn, Schriftführer des
Reichshandwerkerrates. 6. Die Zentral=Genossenschaftskasse. Berichterstatter: Rauchfangkehrermeister Giugno=Brünn, Gewerberat, Präsident
des mährischen Zentral=Genossenschaftsverbandes.
7 Revision des Salzburger Programms. Hauptberichterstatter: Tapezierermeister Krebs=Graz,
Landtagsabgeordneter, Gewerberat, Präsident des"
"innsbrucker_nachrichten_ibn19391128_article_806","de","1939-11-28T00:00:00Z","innsbrucker_nachrichten","https://platform.newseye.eu/iiif/innsbrucker_nachrichten_ibn19391128_page_12/167,1306,1083,1234/!400,200/0/default.jpg","1","Es waren ja vor allem Deutschland, die nordischen Staaten,
Holland und Italien, die in den letzten Jahren die Medizin in
einem außerordentlichen Ausmaß vorwärts getrieben haben,
Vertreter aller dieser Staaten kommen zu Worte. Nach einem
einleitenden Vortrag des stellvertretenden Reichsgesundheitsführers Dr. Blome, der über „Deutsche Gesundheitsführung“
spricht, wird Prof. v. Bergmann=Berlin, der durch die
Einführung der funktionellen Denkweise der Medizin eine
neue Richtung gab, das Wort ergreifen und nach ihm Professor v. Euler=Stockholm, der ebenso wie Prof. Abderhalden=Halle die Lehre von den Vitaminen außerordentlich gefördert hat. Die Vortragsreihe des ersten Tages wird
Prof. Butenandt=Berlin beschließen, der durch die Erforschung der Sexualhormone der Hormonlehre neue Wege
gewiesen hat, zumal er nachweisen konnte, daß die Sexualhormone eine merkwürdige Aehnlichkeit mit den Stoffen
haben, die imstande sind, Krebs hervorzurufen.
Prof. Reiter, der Präsident des Reichsgesundheitsamtes,
wird am Tage darauf mit einem Vortrag über das Wesen der
Infektion den Kursus fortsetzen. Der Schweizer Gelehrte Professor Frey=Bern, der Direktor der dortigen Medizinischen
Universitätsklinik, spricht dann über Hyperämie als Heilmittel
bei Herz= und Gefäßkrankheiten. Prof. Bessau hat die Ernährung des Säuglings auf eine ganz neue Basis gestellt und
wird hierüber vortragen. Prof. Dogmagh=Elberfeld, der
Erfinder des Prontosils, das auf der ganzen Welt höchste Anerkennung, anderseits aber auch viele Nachahmungen gefunden hat, wird selbst über sein Mittel sprechen, ebenso wie
Prof. Kikuth=Wuppertal über das von ihm gefundene
Germanin."
"arbeiter_zeitung_aze19130531_article_246","de","1913-05-31T00:00:00Z","arbeiter_zeitung","https://platform.newseye.eu/iiif/arbeiter_zeitung_aze19130531_page_9/2256,759,1008,153/!400,200/0/default.jpg","1","Volkstümliche Universitätskurse. Heute Samstag um ½8 Uhr abends,
IX. Währingerstraße Nr. 13, Vortrag (mit Lichtbildern) des Privatdozenten Dr. Norbert Krebs: Die Küsten und Randlandschaften der Adria. Daran schließt sich morgen Sonntag eine
Führung in die Adria=Ausstellung."
"innsbrucker_nachrichten_ibn19361016_article_167","de","1936-10-16T00:00:00Z","innsbrucker_nachrichten","https://platform.newseye.eu/iiif/innsbrucker_nachrichten_ibn19361016_page_4/1299,542,1074,943/!400,200/0/default.jpg","1","Von den Beschwerden der Geschwürskranken sind die
krampfartigen Schmerzen charakteristisch, die geraume Zeit
nach der Nahrungsaufnahme auftreten, während bei allen anderen Magenkrankheiten eigentliche Schmerzen sehr selten sind.
Bei Magengeschwür kann es durch Anätzung eines Blutgefäßes
zur Magenblutung kommen. Aber auch bei andersartigen
Magenkrankheiten kann gelegentlich Blutung auftreten, z. B.
bei Magenkrebs. Der Magenkrebs entsteht aus noch unbekannten Ursachen auf dem Boden einer durch chronischen
Magenkatarrh veränderten Magenschleimhaut, selten entartet
ein Magengeschwür krebsig, während das Zwölffingerdarmgeschwür kaum je ein Krebs wird. Zum Unterschiede von der
Geschwürskrankheit klagen die Krebskranken gewöhnlich nicht
über Schmerzen. Die Beschwerden sind ähnlich wie bei Magenkatarrh: Appetitlosigkeit, Aufstoßen, Magendruck. Die Unscheinbarkeit der Beschwerden, die im Beginn der Krankheit vollständig fehlen können, bedingt es, daß der Kranke oft erst im
fortgeschrittenen Stadium seiner Krankheit ärztliche Hilfe sucht.
Aber auch frühzeitig festgestellte Fälle können nur selten gerettet werden und wir besitzen bisher kein Hilfsmittel, um die
Krankheit im Beginne zu erfassen."
"neue_freie_presse_nfp19380818_article_1933","de","1938-08-18T00:00:00Z","neue_freie_presse","https://platform.newseye.eu/iiif/neue_freie_presse_nfp19380818_page_20/2267,3124,1039,748/!400,200/0/default.jpg","1","für
(Drahtbericht unserer Berliner Schriftleitung)
Frankfurt a. M., 18. August
Bei der Trauerfeier für den verstorbenen Gelehrten Leo
Frobenius gedachte Oberbürgermeister Staatsrat Dr. Krebs des
berühmten Forschers, der, immer ein deutscher Mann, das kulturmorphologische Forschungsinstitut wie das Völkermuseum zu
internationalem Rufe gebracht hat. Der Rektor der Universität
Professor Platzhoff legte im Auftrag des Kultusministers Rust
einen Kranz nieder. Er wies darauf hin, daß die wissenschaftliche
Ernte der Forschungsarbeit von Leo Frobenius noch nicht abgeschlossen sei und daß er als ein Anreger größten Stils für die
verschiedensten wissenschaftlichen Disziplinen weiterleben werde.
Es sprachen dann noch der Kurator Wisser des kulturmorphologischen Instituts, der Ordinarius der philosophischen Fakultät
in Königsberg Professor Otto und der ehemalige Adjutant von
Lettow=Vorbeck Baron v. Ruckteschell."
"neue_freie_presse_nfp19380818_article_2308","de","1938-08-18T00:00:00Z","neue_freie_presse","https://platform.newseye.eu/iiif/neue_freie_presse_nfp19380818_page_26/2275,4839,1036,351/!400,200/0/default.jpg","1","dahen vom Dienste Fritz garich, 3
Innanpoltit: t. B. Kurt v. Hirtl (Arlaud); für Außenpolitt: t. B. Dr. Rudolf
Fischer; für den Economist und die volkswirtschaftlichen Beilagen
Dr. Günther Krebs; für Kunst, Chronik und den unpolitischen Teil:
Louis Barcata; für Unterhaltung: Hubert Ritter; für Sport: Ludwig
Schüssel; für Film, Reise und Kraftfahrwesen: Wolfgang Thomas:
für die Anzeigen: Hans Zehetgruber, sämtlich in Wien. Druck und
Verlag: Oesterreichische Journal Ach, Wien, 1. Fichtegasse 11. Die Schriftleitung
betreffende Zuschriften, welcher Art auch immer, bitten wir an die „Schriftleitung“
als solche. nicht aber an einzelne Mitglieber der Schriftleitung zu richten."
"neue_freie_presse_nfp19390113_article_202","de","1939-01-13T00:00:00Z","neue_freie_presse","https://platform.newseye.eu/iiif/neue_freie_presse_nfp19390113_page_5/2233,3698,1034,352/!400,200/0/default.jpg","1","Hauptschriftleiter: Dr. Rubolf Fischer.
Stellvertreter und Chef vom Dienst: Fritz Eckrich. Verantwortlich für Innenpolitik: i. V. Kurt v. Hirtl; für Außenpolitik: Dr. Nudolf Fischer;
für den Economist und die volkswirtschaftlichen Beilagen: Dr. Günther
Krebs; für Kulturpolitik und Unterhaltung: Louis Barcata;
für Musik: Hubert Ritter; für Chronik, Lokales und den unpolitischen Teil:
Wolfgang Thomas; für Sport: Ludwig Schüssel; für die Anzeigen: Hans Zehetgruber, sämtlich in Wien. Die Schriftleitung betreffende Zuschriften, welcher Art auch immer, bitten wir an die „Schriftleitung“
als solche, nicht aber an einzelne Mitglieder der Schriftleitung zu richten.
Derzeit gilt Anzeigenpreisliste Nr. 3. (Für „Kleine Anzeigen“ Preisliste Nr. 1."
"neue_freie_presse_nfp19001217_article_288","de","1900-12-17T00:00:00Z","neue_freie_presse","https://platform.newseye.eu/iiif/neue_freie_presse_nfp19001217_page_6/125,299,1048,2248/!400,200/0/default.jpg","1","[Ein Inbiläum des Schulvereins für
Beamtentöchter.] Im Beisein des Erzherzogs Franz
Ferdinand hat der unter seinem Protectorate siehende Schulverein für Beamtentöchter gestern Vormittags das Fest seines
fünfundzwanzigjährigen Bestandes gefeiert. Auch Erzherzogin
Marie Therese zeichnete die schöne Feier durch ihre Gegenwart ans. Anwesend waren ferner: der Unterrichtsminister Dr.
Ritter v. Hartel, Statthalter Graf Kielmansegg mit
dem Statthaltereirath Wagner Ritter v. Kremsthal,
Polizei=Präsident Habrda, Sections=Chef Ritter v. Halban,
der Vice=Präsident des Landesschulrathes Freiherr v. Bienerth
mit den Landes=Schulinspectoren Kapp und Dr. Relling,
Bürgermeister Dr. Lueger, der Pfarrverweser zu Maria=Treu
Herr Michael Hersan, Landes=Schulinspector Dr. Langl,
Bezirksvorsteher Antensteiner, Regierungsrath Oskar Teuber,
Polizeirath Adami, die Damen Charlotte Frenn v. Königswarter und Vorsteherin des Offieierstöchter=Instituts Gräsin Geldern; weiters das Präsidium des Vereines, bestehend ans dem
Präsidenten Sectionsrath Dr. Ritter v. Zdekauer und dem BieePräsidenten Statihaltereirath Bäumen sowie das Directorium.
Der Präsident, Sectionsrath Dr. Ritter v. Zdekauer, hielt
eine Ansprache an den Protector Erzherzog Franz Ferdinand und
dankte für die dem Vereine bewiesene Huld. Erzherzog Fran;
Ferdinand und Erzherzogin Marie Therese unternahmen dann einen Rundgang durch das Gebäude, wobei
Sectionsrath Dr. v. Zbekauer den Erzherzeg und Fran Willy
Lang=Epstein die Erzherzogin geleiteten. Im Speisesaal sprach ein weiblicher Zögling ein sinniges Gedicht,
worauf der Erzherzog die Vorstellung der Ausschußdamen
Ottilie Bondy, Mathilde Edle v. Czizek, Julie
Mohl und Baronesse Amalie Falke entgegennahm.
Erzherzog Franz Ferdinand sprach in seiner Antwort
den Wunsch aus, der Verein möge stets eine Pflanzstätte für
wahrhaft religiöse Gesinnung und für echte treue Liebe für Kaifer
und Reich sein. Die Worte des Erzherzogs wurden mit stürmis
schen Hochrufen aufgenommen. Dr. Ritter v. Zdekauer stellte
nun die Mitglieder des Directeriems var, und zwar: Ministerialrath Dr. Ritter v. Wretschko, Landes=Schulinspector Dr.
Karl Ferdinand Kummer, Oberst Edlen v. Haradauer,
kaiserlichen Rath Fizia und Oder=Inspector Anton Orleth.
Hierauf erfolgte die Vorstellung der Patronesse Amalie Freiin
Falke v. Lilienstein. Im Sitzungsfaale wurden die Mitglieder des Centralausschusses vorgestellt, und zwar: Pelizeirath
Freiherr v. Gornp, Hof= und Gerichtsadvocat Dr. v. Gschmeidler, Finanzrath v. Lakenbacher, Sections=Chef v. Lee,
Ministerialrath v. Schiel, Baurath Sylvester Tomka,
Statthalterei =Bau=Adjunct Ingenieur Kech, CenkralInspector Karl Werner, Advecat Dr. Zimmermann, Secretär der Nordbahn v. „Dalmata, Regirrungsrath Kathrein, Professer Muten Kleibl und
der langjährige Secretär des Vereims, Geza Walko.
Der Erzherzog und die Erzherzogin besichtigten nech die Zeichnungen der Schülerinnen des Malers Professor Straka und
des Professors Schlegel. Schließlich wurden der Directer der
Handelsschule Joseph Strehle mit dem Lehrkörper und die
Untervorsieherin des Töchterheims Fran Auguste Krebs vergestellt. Sowol der Erzberzog als die Erzherzozin sprachen sich
sehr lobend über die Anstalt aus."
"arbeiter_zeitung_aze19110416_article_414","de","1911-04-16T00:00:00Z","arbeiter_zeitung","https://platform.newseye.eu/iiif/arbeiter_zeitung_aze19110416_page_12/2395,239,1026,568/!400,200/0/default.jpg","1","Eine gute Verdauung, das ist die ungestörte Regelmäßigkeit in dem Vorgang des Stoffwechsels, ist die erste Bedingung der Gesunderhaltung des menschlichen Organismus.
Leider ist sedoch im Leben die Verdauung Störungen ausgesetzt, die die normalen Funktionen unterbinden und Krankheitserscheinungen herbeiführen. Ein Mittel, solche Störungen
hintanzuhalten oder, wenn sie da sind, zu beheben, sind die
Magentropfen, Schutzmarke „Roter Krebs“, welche in der Krebsapotheke S. Mittelbach, Wien, I. Hoher Markt Nr. 8, nach
einem uralten Rezept hergestellt werden. Diese Tropfen, zu
deren Erzeugung die besten und bewährtesten Kräuter und
sonstigen Naturprodukte verwendet werden, sind ein anerkannt
vorzügliches Mittel bei Magenbeschwerden, Kolik, Kopfschmerzen
u. s. w. Sie wirken appetiterregend bei schwachem Magen und
können auf Zucker genommen werden. Der Preis ist ein sehr
mäßiger; er beträgt 1 Krone per Flasche."
"neue_freie_presse_nfp19110723_article_1504","de","1911-07-23T00:00:00Z","neue_freie_presse","https://platform.newseye.eu/iiif/neue_freie_presse_nfp19110723_page_13/2240,706,1027,79/!400,200/0/default.jpg","1","Das große Mittermayersche Legat für Krebs¬"
"neue_freie_presse_nfp19361101_article_697","de","1936-11-01T00:00:00Z","neue_freie_presse","https://platform.newseye.eu/iiif/neue_freie_presse_nfp19361101_page_14/1300,2800,1043,217/!400,200/0/default.jpg","1","dem Wiener Publikum von ihren früheren Konzerten noch in
bester Erinnerung, spielt am 7. Nov. im Kl. M. V. S.: Galuppi,
Dalza, Bach, Cimarosa, Telemann, Krebs, Haydn.
E Anne Antti, 12. Nov., Kl. z. V."
"neue_freie_presse_nfp19130501_article_722","de","1913-05-01T00:00:00Z","neue_freie_presse","https://platform.newseye.eu/iiif/neue_freie_presse_nfp19130501_page_10/2289,4604,1058,215/!400,200/0/default.jpg","1","ältesten Fälle, selbst der für unheilbar erklärten, durch Behandlung,
die sich nur aus bis jetzt unbekannten Pflanzen zusammensetzt.
Verlangen Sie vom Erfinder selbst: Dr. Damman, 76, rue du
Tröne, Bruxelles (Belgien), oder in der Krebs=Apotheke, Wien,
I., Hoher Markt 8, die Broschüre Nr. 1 mit Heilbeweisen. (Geben
Sie an, für welche Krankheit.)"
