id,language,date,newspaper_id,iiif_url,relevancy,text
"innsbrucker_nachrichten_ibn19360819_article_268","de","1936-08-19T00:00:00Z","innsbrucker_nachrichten","https://platform.newseye.eu/iiif/innsbrucker_nachrichten_ibn19360819_page_6/1317,558,1077,1375/!400,200/0/default.jpg","1","in seiner Heimat, ist wohl deshalb in diese Reihe aufgenommen
worden, damit Siebenbürgen überhaupt vertreten ist, geschichtlich kommt ihm wohl nicht eine entsprechende Bedeutung zu.
An Tirolern finden wir also in diesem Buche „Große
Deutsche“ den Andreas Hofer und den Maler Koch. Bezeich
nenderweise schrieb unter dessen Bildnis der Zeichner „Josef
Koch von Tyrol“, der aus dem Lechtal stammende Meister
hat sich offenbar in Rom selbst gerne als Tiroler ausgegeben.
Weiter finden wir in diesem Buche einen alten Bischof von
Brixen, den Nikolaus Krebs von Kues im Moselland,
meist Kusanus genannt, der mit Recht als ein Bahnbrecher
der Wissenschaft im 15. Jahrhundert gilt, seine Werke allerdings
vor seiner Regierung als Bischof von Brixen verfaßt, als solcher
mit seiner gegen den damaligen Landesfürsten von Tirol, Herzog Sigmund, gerichteten Politik wohl viel Unruhe im Lande
gestiftet, aber für sein Fürstentum nichts erreicht hat.
Man könnte zu der Auswahl der Männer für diese
Sammlung „Große Deutsche“ wohl noch manche Ergänzung
vorschlagen. Offenbar sollte die Zahl überhaupt eine gewisse
Grenze nicht überschreiten. Dennoch muß man sich wundern,
daß zum Beispiel keiner der neueren Dichter Oesterreichs Aufnahme gefunden hat, Stephan George aber gleich mit zwei
Darstellungen. Unter den Heerführern vermißt man den Türkensieger Markgraf Ludwig von Baden, der so erfolgreich
den geschichtlichen Zusammenhang Deutsches Reich und Oesterreich verkörpert. Prinz Eugen von Savoyen ist wohl mit
Rücksicht auf seine Abstammung nicht aufgenommen worden,
er hat sich aber in seiner weltgeschichtlichen Wirksamkeit gewiß
als ein Angehöriger des Römischen Reiches deutscher Nation
und der österreichischen Monarchie gefühlt."
"neue_freie_presse_nfp19000920_article_1654","de","1900-09-20T00:00:00Z","neue_freie_presse","https://platform.newseye.eu/iiif/neue_freie_presse_nfp19000920_page_16/1739,1474,1080,248/!400,200/0/default.jpg","1","Pälton Grand Hôtel Pittner, rother Krebs
St, Polich. 80 Schritte vom Bahnhöfe, inmitten der Stadt
101 Zimmer mit Salon, in jedem Stock Telephon, neu hochfein
möblirt, neueste Heizungsanlagen. Wasserleit. und FeuerHydranten in jedem Stockwerke, Bäder im Hause. Grösstes und
feinstes Restaurant der Stadt. Zimmer von 50 kr. aufwärts. 12543"
"neue_freie_presse_nfp19110617_article_964","de","1911-06-17T00:00:00Z","neue_freie_presse","https://platform.newseye.eu/iiif/neue_freie_presse_nfp19110617_page_9/1161,2344,1049,1866/!400,200/0/default.jpg","1","Gesellschaft vom Oesterreichischen Silbernen Kreuze
zur Fursorge für heimkehrende Reservisten.
Außer den bereits ausgewiesenen Spenden sind noch nachstehende Beiträge eingelaufen: Gemeinde Wien 20.000 K., Albert
Freiherr v. Rothschild 10.000 K., Oesterreichische MannesmannRöhrenwerke 10.000 K., Allgemeine Depositenbank 500 K., Angloösterreichische Bank 5000 K., Mathilde Bauer 5 K., Regierungsrat
Dr. J. Th. Baumfeld 100 K., kaiserlicher Rat Oskar Berl 1000 K.,
Fritz Bertram 10 K., Bodenkreditanstalt 3000 K., Brauherrenverein
2000 K., August Budischowsky 500 K., Julius Bunzl 100 K.,
Hermann Glesser 10 K., Creditanstalt für Handel und Gewerbe
3000 K., Herzog von Cumberland 1000 K., Anton Dreher 1000 K.,
Ehepaar A. E. W, Iullus Enzinger 3 K., Julius Epstein 50 K.,
Felix Fischer 100 K., Marcus Fischl 2 K., F. K. 2 K., kaiserlicher
Rat Alexander Freud 50 K., Marie Friedmann 500 K., G. F. Fritz
1000 K., Dr. Paul Georg Funk 10 K., Friedrich Ritter Gaigg von
Bergheim 10 K., Franz Galla 3 K., Franz Gilly 100 K., Heinrich
Goldlust 100 K., Emil Goldschmid 10 K., Dr. Franz Graf 100 K.,
Peter Grasböck 10 K., k. und k. Major Grünebaum 3000 K., Hans
Grünzweig 20 K., Gutsverwaltung Guntramsdorf 3 K., Eduard
Haida 3 K., Johann Hamenik 3 K. 50 H., Dr. Alfred Havranek
10 K., Jukius Herz 500 K., Dr. Berthold Herzig 5 K., Dr. Hugo
v. Hofmannsthal 50 K., A. Horlivy 3 K., Samuel v. Horowitz
500 K., Edmund Horst 20 K., J. G. 10 K., Baron Rudolf Isbary
50 K., Anton Janka für sich und Frau Marie 20 K., Heinrich
Jäger jun. 50 K., Johann Jaremkiewicz 100 K., JubiläumsUnterstützungsfonds 10 K., Dr. Hugo v. Kager 10 K.,
Alexander Kallir 50 K., Franz Keiler sen. und jun. 20 K.,
Graf Kerschenbach 10 K., Baron Oskar Klinger 1000 K.,
Wenzel Kotz Freiherr v. Dobrz 100 K., Heinrich Krebs 1 K.,
Kriegsministerium 1000 K., Graf Franz Kuefstein 10 K., Rudolf
Kurz 3 K., Dr. König 10 K., Landesverteidigungsministerium
1000 K., Länderbank 3000 K., Karl Lang 50 K., Otto Lang 10 K.,
Josef Lamac 3 K., Adolf Laubek 5 K., Josef Hans Leithner 10 K.,
Alois Lemberger 100 K., Richard Lieben 500 K., Anton Locs von
Losinfeldt 10 K., Karl Mader 3 K., Franz Matheis 100 K., kaiserlicher Rat Dr. Emil Medinger 1000 K., S. Mehr 3 K., Georg
R. v. Metaxa 100 K., J. R. v. Metaxa 50 K., kaiserlicher Rat
Dr. Friedrich Münzer 300 K., Alexander Nirenstein 50 K., Doktor
Jakob Nirenstein 50 K., Hugo v. Noot 500 K., Niederösterreichischer
Mühlenverband 300 K., Graf Karl Erwin Nostitz 20 K., Anton
Pferschy 3 K., Anna Pitsch 20 K., Dr. Franz Pollaczek 2 K.,
kaiserlicher Rat Wilhelm Pollak 100 K., Gräfin Pötting=Podstatzky
60 K., Th. Raßl 10 K., Ratka 3 K., Anton Reinisch 3 K., Franz
R. v. Regenhart=Zapory 300 K., Reichsverband der Fabrikanten
und Händler 100 K., Baronin Emma Salis 3 K., Franz Schlögl
11 K., E. Schmiedl 20 K., Ludwig Schneider 200 K., Rudolf
Schoch 5 K., W. Schostal 100 K., Karl Schröpfer 3 K., Benjamin
Schwarz 10 K., Karl Schwarz 20 K., Gustav Sommer 3 K., Toni
Smeikal 5 K., Moritz Seidel 10 K., Dr. Stauffer 50 K., Adele
Taahen 3 K., Jakob Thonet 500 K., Stella v. Turnau 7 K.,
Unionbank 2000 K., Vater eines Reservisten 50 K., Verband der
Fruchtsäfteerzeuger 50 K., Rudolf Vosseler 10 K., Max N. Wechsler"
"neue_freie_presse_nfp19110617_article_1160","de","1911-06-17T00:00:00Z","neue_freie_presse","https://platform.newseye.eu/iiif/neue_freie_presse_nfp19110617_page_11/177,328,2099,2094/!400,200/0/default.jpg","1","Ruse.) Hierauf hielt Professor Dr. Th. Schmidt,
Chirurg der Wiener tierärztlichen Hochschule,
„über das Vorkommen
s an den Hofjagden teilnahm. Volle 45 Jahre stand Titz
staatlichen und im Hofjagddienst
er des Kaisers, als er 1905 aus seiner staatlichen Stellung
den Ruhestand trat. Er diente ehemals als absolvierter
giabrunner Akademiker praktisch im Wienerwald, dann bei
Finanzlandesdirektion in Wien, wurde Forstmeister der
K. Forst= und Domänendirektion für Steiermark und
iten und dann mit der Leitung der Direktion in Görz beut. 1887 kam er als Vorstand der Forst= und Domänenkktion nach Gmunden und im Jahre 1896 erhielt er den
 und Charakter eines Hofrates. Später erfolgte die Erung zum Wirklichen Hofrat und im Jahre 1910 die ErWährend seines 18jährigen
kens in Gmunden war Hofrat v. Titz lange Jahre erster
präsident des Forstvereines für Oberösterreich und Salzdes Jagdklubs „Hubertus“ und
1894 gehörte er auch der Gemeindevertretung Gmunden,
1889 der Kurkommission an. Titz war ein chevaleresker
d liebenswürdiger Mann, der mit der Einwohnerschaft des
lzkammergutes bis zu seinem Lebensende innigen Kontakt
tte und sich die Sympathien aller erwarb, die mit ihm in
rührung kamen. Auch den Kurgästen des Salzkammergutes
ir er wohl bekannt. Forstmann und Jäger mit Leib und
eele, hat er seinem Berufe stets treu und unter Zurücksetzung
persönlichen Interessen in Selbstlosigkeit
Fährend der verschiedenen Hochwasserkatastrophen im
ammergute griff er überall ratend und helfend ein.
m die Errichtung der Schutzhütte auf dem Traunstein und
vielen anderen Fällen der Förderung lokaler Interessen
nd des Fremdenverkehrs hat der kaiserliche Jagdleiter, der
hrenbürger von Gmunden war, bleibende Verdienste. Hofrat
.Titz besaß die höchsten in= und ausländischen Dekorationen,
arunter das Ritterkreuz des Leopolds= und das Komturkreuz
es Franz Josefs=Ordens. Das kaiserliche Leibgehege umfaßt
ie Forstbezirke des oberösterreichischen und steiermärkischen
Salzkammergutes, darunter Traunstein, Ebensee, Bad Ischl,
att, Gosau, Mondsee, ferner Aussee, Grundlsee
d Hinterberg. Als die Grafschaft Ort und später das Kloster
raunkirchen samt allem Zugehör in kaiserlichen Besitz überangen waren, wurde die Leitung des Jagdwesens in dieser
eister übertragen und ihm diesbösartigen Neubildungen
(Krebs 2c.) bei den Haustieren. Die gleiche Frage behandelte
Professor Dr. Hartl vom Standpunkte der pathologischen
Anatomie, und wies namentlich auf die inneren krebsartigen
Ertrankungen der Tiere hin.
ing in den Adelsstand. Wu An. .
g, Obmannstellvertreter
oisern, Hallstatiz, Mühe käufleen,
egend einem eigenen Jägerme
üglich auch das übrige
ege unterstellt.
der Forstbezirke, die vom
icht selbst bejagt werden, sind anderweitig in Pacht
Die Stückzahl des im kaiserlichen Leibgehege inssamt vorhandenen Wildes (Hochwild,
eträgt ungefähr 5000; der jährliche Abschuß hievon ungefähr
000. Die kaiserliche Hofjagdleitung wurde anfangs de
Fahres 1869 ins Leben gerufen und hatte bis zum Jahre
905 ihren Sitz ausschließlich in Gmunden. Dann wurde sie
tach Ebensee verlegt, wo der kaiserliche Hofjagdleiter Leo von
hatte, während er im
Gemsen und Rehe)
itz seinen Wohnsitz
Pinter in Salzburg wohnte."
"neue_freie_presse_nfp19000628_article_1641","de","1900-06-28T00:00:00Z","neue_freie_presse","https://platform.newseye.eu/iiif/neue_freie_presse_nfp19000628_page_17/131,2487,1059,212/!400,200/0/default.jpg","1",""" D“itan Grand Hôtel Pittner, rother Krebs,
St. 1 Oiten. 80 Schritte vom Bahnhofe, inmitten der Stadt,
101 Zimmer mit Salon, in jedem Stock Telephon, neu hochfein
möblirt, neueste Heizungsanlagen, Wasserleit. und FeuerHydranten in jedem Stockwerke. Bäder im Hause. Grösstes und
feinstes Restaurant der Stadt. Zimmer von 50 kr. aufwärts. 12543"
"neue_freie_presse_nfp19000623_article_1856","de","1900-06-23T00:00:00Z","neue_freie_presse","https://platform.newseye.eu/iiif/neue_freie_presse_nfp19000623_page_17/1131,2695,1047,32/!400,200/0/default.jpg","1","Et Dalsan Grand Hotel Pittner, rother Krebs,"
"illustrierte_kronen_zeitung_krz19390202_article_197","de","1939-02-02T00:00:00Z","illustrierte_kronen_zeitung","https://platform.newseye.eu/iiif/illustrierte_kronen_zeitung_krz19390202_page_6/1883,3147,788,244/!400,200/0/default.jpg","1","mildert Husten,
löst Schleim,
auf die Lunge wohltuend!
Alle Apotheken führen Ihn! Auch für Kinder!
Orig.-Packung zu RM —.93 und 1.54
Depot: „Krebs-Apotheke“, Wien, I., Hoher Markt 8, Abt. 568"
"neue_freie_presse_nfp19360605_article_406","de","1936-06-05T00:00:00Z","neue_freie_presse","https://platform.newseye.eu/iiif/neue_freie_presse_nfp19360605_page_8/2316,3397,1032,361/!400,200/0/default.jpg","1","(Betrügereien eines Wiener Vertreters in Graz.)
Kürzlich wurde in Graz der Generalvertreter einer Wiener Firma
für Steiermark namens Otmar Krebs verhaftet. Er vertrieb ein
Futtermittel für Tiere, ein sogenanntes Nährkraftmehl, und hat
seine Firma dadurch um etwa 25.000 Schilling geschädigt, daß
er große Mengen des Produktes verschleuderte, sowie Provisionssummen für fingierte Aufträge verrechnete. Vier Personen, die
ihm bei seinen betrügerischen Machinationen Vorschub geleistet
haben, wurden gleichfalls verhaftet."
"illustrierte_kronen_zeitung_krz19390404_article_308","de","1939-04-04T00:00:00Z","illustrierte_kronen_zeitung","https://platform.newseye.eu/iiif/illustrierte_kronen_zeitung_krz19390404_page_11/112,1756,607,66/!400,200/0/default.jpg","1","Großoffensive gegen den Krebs"
"innsbrucker_nachrichten_ibn19110329_article_1066","de","1911-03-29T00:00:00Z","innsbrucker_nachrichten","https://platform.newseye.eu/iiif/innsbrucker_nachrichten_ibn19110329_page_24/138,3947,1237,536/!400,200/0/default.jpg","1","Zu dieser Zeit traf ich zum erstenmal mit Herrn Latour
in der Decaturstraße zusammen. Sofort kam mir der Gedanke, das sei der Mann, den ich brauchte, und fing an, ihn
systematisch meinem Willen zu unterjochen. Hiebei begünstigten
mich die besonderen Umstände ungemein. Er war arm, oder
doch ohne nennenswerte Mittel. Seine Tochter konnte wohl
etwas erwerben, aber nicht genug, um die Not fernzuhalten.
Dazu litt er am Krebs, und mehrere Arzte hatten ihm versichert,
er werde höchstens noch ein Jahr zu leben haben. So peinigte
ihn eine fast wahnsinnige Furcht, seine Tochter würde nach seinem
Tode notleiden, und ich glaube, diese Furcht war auch der
wahre Grund, weshalb er sich dem Spiel ergeben hatte; denn"
"neue_freie_presse_nfp19380807_article_165","de","1938-08-07T00:00:00Z","neue_freie_presse","https://platform.newseye.eu/iiif/neue_freie_presse_nfp19380807_page_5/2242,2244,1018,341/!400,200/0/default.jpg","1","ahel vom Diast. Frig Cärich. Der
otenpaktik: i. B. Kurt v. Hirtl; für Außenpolitir: i. B. Dr. Rubolf
ischer; für den Economist und die volkswirtschaftlichen
r. Günther Krebs; für Kunst, Chronik und den unpolitischen Teil:
ouis Varcata; für Unterhaltung: Hubert Ritter; für Sport: Lud:
chufsel: für Film, Reise und Kraftfahrwesen: Wolfgang Thomas:
r die Anzeigen: Hans Zehetgruber, sämtlich in Wien. Druck und
erlag: Oesterreichische Journal Ach, Wien, 1. Fichtegasse 11. Die Schriftleitung
etreffende Zuschriften, welcher Art auch immer, bitten wir an die „Schriftleitung“
s solche, nicht aber an einzelne Mitglieder der Schriftleitung zu richten"
"neue_freie_presse_nfp19380730_article_234","de","1938-07-30T00:00:00Z","neue_freie_presse","https://platform.newseye.eu/iiif/neue_freie_presse_nfp19380730_page_5/2190,4826,1037,338/!400,200/0/default.jpg","1"," Hauptschriftleiter: Dr. Nudolf Fischer.
Stellvertreter und Chef vom Dienst: Fritz Eckrich. Verantwortlich für
Innenpolitik: i. V. Kurt v. Hirtl; für Außenpolitik: i. V. Dr. Rudolf
Fischer; für den Economist und die volkswirtschaftlichen Beilagen
Dr. Günther Krebs; für Kunst, Chronik und den unpolitischen Teil:
Louis Barcata; für Unterhaltung: Hubert Ritter; für Sport: Ludwig
Schüssel; für Film, Reise und Kraftfahrwesen: Wolfgang Thomagi
für die Anzeigen: i. V. Raimund Anders, sämtlich in Wien. Druck uno
Verlag: Oesterreichische Journal AG, Wien, 1. Fichtegasse 11. Die Schriftleitung
befreffende Zuschriften, welcher Art auch immer, bitten wir an die „Schriftleitung“
als fosche, nicht aber an einzelne Mitglieder der Schriftleitung zu richten"
"neue_freie_presse_nfp19380730_article_1916","de","1938-07-30T00:00:00Z","neue_freie_presse","https://platform.newseye.eu/iiif/neue_freie_presse_nfp19380730_page_24/2258,4834,1033,244/!400,200/0/default.jpg","1","Dr. Rudolf Fischer.
tellvertreter und Chef vom Dienst: Fritz Eckrich. Verantwortlich für
nnenpolitik: i. V. Kurt v. Hirtl; für Außenpolitik: i. V. Dr. Rudolf
ischer; für den Economist und die volkswirtschaftlichen Beilagen
r. Günther Krebs; für Kunst, Chronik und den unpolitischen Teilt
ouis Barcata; für Unterhaltung: Hubert Ritter; für Sport: Ludwig
chüssel; für Film, Reise und Kraftfahrwesen: Wolfgang Thomas;
r die Anzeigen: i. V. Raimund Anders, sämtlich in Wien. Druck und"
"neue_freie_presse_nfp19000818_article_1477","de","1900-08-18T00:00:00Z","neue_freie_presse","https://platform.newseye.eu/iiif/neue_freie_presse_nfp19000818_page_16/1194,660,1056,224/!400,200/0/default.jpg","1","St Dziton Grand Hôtel Pittner, rother Krebs,
Wt. 1 Oiten. 80 Schritte vom Bahnhofe, inmitten der Stadt,
101 Zimmer mit Salon, in jedem Stock Telephon, neu hochfein
möblirt, neueste Heizungsanlagen, Wasserleit. und FeuerHydranten in jedem Stockwerke, Bäder im Hause. Grösstes und
feinstes Restaurant der Stadt. Zimmer von 50 kr. aufwärts. 12543"
"arbeiter_zeitung_aze19000903_article_181","de","1900-09-03T00:00:00Z","arbeiter_zeitung","https://platform.newseye.eu/iiif/arbeiter_zeitung_aze19000903_page_4/1319,4547,1377,73/!400,200/0/default.jpg","1","Auch versenden die Avolh=ke zum „König von Ungarn“, Fleischmarkt 1, und Krebs=Apolheke, Hoher
Markt 8 in Wien, 5 und mehl Flaschen Krauter=Wein zu Originalpreisen nach allen Orten Oesterreich=Ungarns."
"illustrierte_kronen_zeitung_krz19110414_article_145","de","1911-04-14T00:00:00Z","illustrierte_kronen_zeitung","https://platform.newseye.eu/iiif/illustrierte_kronen_zeitung_krz19110414_page_6/569,3205,1031,277/!400,200/0/default.jpg","1","Die Touristenschutzhäuser zu den Osterfeiertagen.
Während der Osterfeiertage werden folgende Touristenhäuser im Wiener Ausflugsgebiet bewirtschaftet sein: Franz
Krebs=Haus am Schöpfl, Unterkunftshaus am Eisernen Tor,
Reisalpen=Schutzhaus, Türnitzer Högerhütte, Eisensteinhütte,
Annabergerhütte am Tirolerkogel, Kaspar Geitner=Haus am"
"neue_freie_presse_nfp19360530_article_2536","de","1936-05-30T00:00:00Z","neue_freie_presse","https://platform.newseye.eu/iiif/neue_freie_presse_nfp19360530_page_26/1240,975,1045,695/!400,200/0/default.jpg","1","Zum Schluß hielt Dr. J. Lartschneider aus Linz als
Gast einen Vortrag über „Wie verhalten sich in Krebsherdnähe
gerückte Drüsen und Blutgefäße?“ Mit Hilfe von projizierten
Bildern mikroskopischer Präparate erläuterte der Vortragende die
Entwicklung des Krebses beim Frosche. Da der Frosch ein Kaltblüter ist, kann er nicht mit Entzündungserscheinungen um den
Krebsherd reagieren, so daß das Bild ganz ungestört verfolgt
werden kann. Er zeigte nun, daß die Krebszellen nicht
durch Teilung entstehen, sondern daß der Krebs nach
und nach die einzelnen Zellen ergreift und so ganz bestimmte
Veränderungen hervorruft. An der Aussprache beteiligten sich
Hofrat Professor v. Wagner=Jauregg und Dr. Paul
Neuda sowie der Vorsitzende. Das jedenfalls neu entwickelte
Problem wird zur Nachprüfung aneifern und möglicherweise die
Deutung der Krebsentstehung von einem neuen Gesichtspunkte
aus zeigen."
"neue_freie_presse_nfp19000330_article_310","de","1900-03-30T00:00:00Z","neue_freie_presse","https://platform.newseye.eu/iiif/neue_freie_presse_nfp19000330_page_7/2273,139,1041,288/!400,200/0/default.jpg","1","Die Malersgattin Caroline Krebs berichtet, sie habe an
30. Januar auf Anordnung des Arztes Dr. Hofmann ihr Kind
in das St. Josephsspital gebracht, damit es dort mit Serum geimpft
werde. Als sie ihr Anliegen vorbrachte, sagte ein Arzt (erregt einen
zankenden Ton nachahmend): „Was glaubt denn der Herr Dr. Hofmann, wozu wir da sind? Die Kinder sollen wir hier impfen, was
glaubt er denn?“ Ich habe gebeten, das Kind möchte nun doch
geimpft werden, da hat der Herr Doctor (auf Dr. Melzer zeigend)"
"neue_freie_presse_nfp19361111_article_148","de","1936-11-11T00:00:00Z","neue_freie_presse","https://platform.newseye.eu/iiif/neue_freie_presse_nfp19361111_page_4/215,1216,1031,562/!400,200/0/default.jpg","1","Spanischen Reitschule.
Die Gemahlin des königlich italienischen Außenministers Gräfin Edda Ciano begab sich gestern vormittag
in Begleitung der Gattin des Staatssekretärs für Aeußeres
Marianne Schmidt in die Spanische Reitschule, wo eine
Vorführung stattfand. Gräfin Ciano sprach sich in besonders
anerkennenden Worten über die Schönheit der Darbietungen aus. Anschließend besichtigte sie unter der
Führung des Ministerialrates Dr. Krebs die Stallungen.
Nachher besuchte Gräfin Ciano die hiesige italienische
Schule in der Ungargasse."
"innsbrucker_nachrichten_ibn19360713_article_499","de","1936-07-13T00:00:00Z","innsbrucker_nachrichten","https://platform.newseye.eu/iiif/innsbrucker_nachrichten_ibn19360713_page_10/173,4452,712,51/!400,200/0/default.jpg","1","und Präsidentenswitwe Rosina Krebs."
"neue_freie_presse_nfp18710127_article_934","de","1871-01-27T00:00:00Z","neue_freie_presse","https://platform.newseye.eu/iiif/neue_freie_presse_nfp18710127_page_14/1285,4388,350,528/!400,200/0/default.jpg","1","Baden, Landsa
Bologna, Tassi, Apothek.
Brood(Slavon.), J.D. Elia.
Brünn, L. Lusad, Ap. „Krebs“
W. Fadenhecht.
Cortina, Cambruzzi Adr.
Döbling, Floder, Apoth.
Gmunden, Reymann, Ap.
Graz, Jos. Purgleitner, Ap.
Rosenberg.
Gr.-Ullersdorf, Müller.
Güns, St. Csacsirovicz, Ap.
Hall (Tirol), L. v. Aichinger.
Jägerndorf, Spatzier, Ap.
Kaaden, Hellmesser, Ap.
Karlstadt (Croat.), Meder,
Apotheker.
Korneuburg, Kwizda, Ap.
Krakau, Jos. Jahn.
Krelbitz, Joseph Hille."
"illustrierte_kronen_zeitung_krz19390127_article_214","de","1939-01-27T00:00:00Z","illustrierte_kronen_zeitung","https://platform.newseye.eu/iiif/illustrierte_kronen_zeitung_krz19390127_page_7/887,876,790,933/!400,200/0/default.jpg","1","Daß die Auswirkungen der Tuberkulose
durch planmäßige Erfassung stark eingeschränkt
werden können, zeigen die Statistiken aus dem
Gebiet der Ostmark. Darnach entfällt der höchste
Prozentsatz von 11.2 Promille an TuberkuloseGestorbenen auf das Land Tirol, das nur zwei
Tuberkulosefürsorgestellen aufweist. Den nächsthöchsten Prozentsatz weist Niederdonau mit
8.3 Promille Tuberkulose=Gestorbenen auf.
Dieser Gau verfügt über 13 Tuberkulosefürsorgestellen. Erst an dritter Stelle kommt Wien, das
als Großstadt naturgemäß am meisten gefährdet
ist. Hier beträgt der Satz 8 von 10.000, wobei
Wien allerdings auch 23 Tuberkulosefürsorgestellen aufwies. Wie hoch verhältnismäßig die
Zahl der Todesfälle durch Tuberkulose ist, ergibt sich daraus, daß im Jahr 1936 von 88.902
Todesfällen in der Ostmark 5608 durch Tuberkulose bedingt waren. Damit steht die Tuberkulose nach dem Krebs, dem Gehirnschlag, der
Lungenentzündung und den Herzkrankheiten an
fünfter Stelle als Todesursache. Bei
den ansteckenden Krankheiten aber steht die
Tuberkulose an erster Stelle der Sterblichkeitsziffer. 1923 starben in der Ostmark noch 23 von
10.000 Menschen an Tuberkulose."
"neue_freie_presse_nfp19000913_article_2013","de","1900-09-13T00:00:00Z","neue_freie_presse","https://platform.newseye.eu/iiif/neue_freie_presse_nfp19000913_page_19/2162,1129,1070,260/!400,200/0/default.jpg","1","Grand Hôtel Erzherzog Johann.
Semmerlng. Modernes Haus für die vornehme Welt.
130 Zimmer in verschiedener Grösse mit jedem Comfort, reizende
Salons, eine grosse schöne Halle, feines Kaffechaus etc. etc. Im
Zimmerpreis Alles inbegriffen: Service, elektr. Licht u. Heizung.
Prospecte gratis. Telegramm- Adresse: „Erzjohann, Semmering“.
St Daitan Grand Hôfel Pittner, rother Krebs"
"neue_freie_presse_nfp18710111_article_1034","de","1871-01-11T00:00:00Z","neue_freie_presse","https://platform.newseye.eu/iiif/neue_freie_presse_nfp18710111_page_15/77,4313,349,485/!400,200/0/default.jpg","1","Landschafts=Apoth.
Bologna, Tassi, Apothek.
Brood(Slavon.), J. D. Elia.
Brünn, L.Lusad, Ap. „Krebs“
Brzezan. W. Fadenhecht.
Cortina, Cambrnzzi Adr.
Döbling, Floder, Apoth.
Gmunden, Reymann, Ap.
Graz, Jos. Purgleitner, Ap.
Gr.-Kantzsa, Rosenberg.
Gr.-Ullersdorf, Müller.
Güns, St. Csacfirovicz, Ap.
Kall (Tirol), L. v. Aichinger.
Jägerndorf, Spatzier, Ap.
Kaaden, Hellmesser, Ap.
Karlstadt (Croat.), Meder,
Apotheter.
Korneuburg, Kwizda, Ap.
Krakau, Joj. Jahn."
"innsbrucker_nachrichten_ibn19360710_article_118","de","1936-07-10T00:00:00Z","innsbrucker_nachrichten","https://platform.newseye.eu/iiif/innsbrucker_nachrichten_ibn19360710_page_3/1298,693,1078,788/!400,200/0/default.jpg","1","Zu den schrecklichsten und grausamsten Krankheiten, die die
Menschheit kennt, gehört der Krebs. Diese furchtbare Krankheit befällt aber nicht nur den Organismus des einzelnen
Menschen, sie kann genau so unfehlbar todbringend einen ganzen Volkskörper befallen. Wie sich hier die Symptome äußern,
sehen wir wiederum aus den Ziffern des Bundesamtes für
Statistik. Frankreich hatte im Jahre 1934 einen Geburtenüberschuß von 43.000 Personen. Das Furchtbare dieses Geburtenüberschusses besteht aber darin, daß die rund 38 Millionen
Franzosen ein jährliches Geburtendefizit von 7000, hingegen die drei Millionen Ausländer einen Geburten überschuß von 50.000 Menschen aufweisen. Ich weiß
nicht, wieviele von diesen Ausländern etwa Neger sind, sicherlich sind es viele tausende; aber wir sehen das grauenerregende
Schauspiel, daß sich in einem Volkskörper eine krebsartige
Neubildung zeigt, die unaufhaltsam zu seiner Vernichtung
führen muß."
"neue_freie_presse_nfp19380729_article_223","de","1938-07-29T00:00:00Z","neue_freie_presse","https://platform.newseye.eu/iiif/neue_freie_presse_nfp19380729_page_5/2199,4831,1045,348/!400,200/0/default.jpg","1","Hauptschriftleiter: Dr. Rudolf Fischer.
Stellvertreter und Chef vom Dienst: Fritz Eckrich. Verantwortlich für
Innenpolitik: i. V. Kurt v. Hirtl; für Außenpolitik: i. V. Dr. Rudolf
für den Economist und die volkswirtschaftlichen Beilagen
Dr Ghünther Krebs; für Kunst, Chronik und den unpolitischen Teil:
Louis Barcata; für Unterhaltung: Hubert Ritter; für Sport: Ludwig
Schüssel; für Film, Reise. und Kraftfahrwesen: Wolfgang Thomas:
für die Anzeigen: i. V. Raimund Anders, sämtlich in Wien. Druck und
Verlag: Oesterreichische Journal AG, Wien, 1. Fichtegasse 11. Die Schriftleitung
betreffende Zuschriften, welcher Art auch immer, bitten wir an die „Schriftleitung“
als solche, nicht aber an einzelne Mitglieder der Schriftleitung zu richten."
